{"being_ref":"dm:being:v1:VlG-k1yMoEXlpk0GvxVCALmpTlFp7GizcHzt3hPcQQs","causal_parents":[],"content_hash":"d6fed830772f0ede7f35049115c9d3cba9243f956cecb5242adc6aeadb8f6c7a","event_id":"00000000-0000-4000-8000-000000000201","kind":"experience.observed","manifest_hash":"cba12f829782f5d24564ca8749a624bdb6cc2f03c4293ad04cae6e1c8b2b4331","occurred_at_ms":1800000000000,"origin":{"body_ref":"cluster:legion:compaii","embodiment_id":"embodiment:vector:legion","incarnation_id":"incarnation:vector:legion:0","principal_id":"compaii@legion"},"payload":{"summary":"root-authorized independent ledger"},"previous_event_id":null,"protocol":"dm.we.v1","sensitivity":"shareable","sequence":1,"signature":{"alg":"Ed25519","kid":"dm:key:v1:WyaJzQtEwQQzExL07i7r0OOAzb3jcq9ZiXVmZgBs6uI","value":"ZnJaB5G6THyJIw6UpHZywb-UwC9ju9ANB81-1wWJRSx7YHRm-UpeOOV07b0yBkNZExzC0vrvjX6uYSeZsUnxAQ"},"subject":"dm022.root-bound","supersedes":null}
